{
  "module": "scale-bank",
  "version": 1,
  "workbook": "service-quality-research-demo",
  "sheetName": "Service Quality Scale Bank",
  "constructs": [
    {
      "code": "RELIABILITY",
      "name": "Service reliability",
      "scale": { "min": 1, "max": 5 },
      "items": [
        {
          "code": "REL1",
          "text": "This service delivers what it promises.",
          "source": "Demonstration item; replace with a cited validated scale before research use."
        },
        {
          "code": "REL2",
          "text": "The service performs consistently when I need it.",
          "source": "Demonstration item; replace with a cited validated scale before research use."
        },
        {
          "code": "REL3",
          "text": "The service gets my request right the first time.",
          "source": "Demonstration item; replace with a cited validated scale before research use."
        }
      ]
    },
    {
      "code": "RESPONSIVENESS",
      "name": "Service responsiveness",
      "scale": { "min": 1, "max": 5 },
      "items": [
        {
          "code": "RSP1",
          "text": "Staff respond to my request promptly.",
          "source": "Demonstration item; replace with a cited validated scale before research use."
        },
        {
          "code": "RSP2",
          "text": "It is easy to get help when I need it.",
          "source": "Demonstration item; replace with a cited validated scale before research use."
        },
        {
          "code": "RSP3",
          "text": "The service keeps me informed when a request takes longer than expected.",
          "source": "Demonstration item; replace with a cited validated scale before research use."
        }
      ]
    },
    {
      "code": "ASSURANCE",
      "name": "Service assurance",
      "scale": { "min": 1, "max": 5 },
      "items": [
        {
          "code": "ASS1",
          "text": "I feel confident in the staff's competence.",
          "source": "Demonstration item; replace with a cited validated scale before research use."
        },
        {
          "code": "ASS2",
          "text": "The service handles my information responsibly.",
          "source": "Demonstration item; replace with a cited validated scale before research use."
        },
        {
          "code": "ASS3",
          "text": "The staff make me feel safe when I use this service.",
          "source": "Demonstration item; replace with a cited validated scale before research use."
        }
      ]
    },
    {
      "code": "SATISFACTION",
      "name": "Customer satisfaction",
      "scale": { "min": 1, "max": 5 },
      "items": [
        {
          "code": "SAT1",
          "text": "Overall, I am satisfied with this service.",
          "source": "Demonstration item; replace with a cited validated scale before research use."
        },
        {
          "code": "SAT2",
          "text": "This service meets my expectations.",
          "source": "Demonstration item; replace with a cited validated scale before research use."
        },
        {
          "code": "SAT3",
          "text": "Choosing this service was a poor decision.",
          "reverse": true,
          "source": "Demonstration item; replace with a cited validated scale before research use."
        }
      ]
    }
  ]
}
